{
  "$schema": "https://json-schema.org/draft/2020-12/schema",
  "$id": "https://backdrop-augmentation-protocol.github.io/spec/versions/0.1.0/schemas/message.schema.json",
  "title": "BAP Message",
  "type": "object",
  "additionalProperties": false,
  "required": ["protocol", "kind", "id", "timestamp"],
  "properties": {
    "protocol": {"$ref": "common.schema.json#/$defs/protocol"},
    "kind": {"enum": ["request", "response", "event"]},
    "id": {"type": "string", "pattern": "^[A-Za-z0-9][A-Za-z0-9._:-]{0,127}$"},
    "sessionId": {"type": "string", "pattern": "^[A-Za-z0-9][A-Za-z0-9._:-]{0,127}$"},
    "correlationId": {"type": "string", "pattern": "^[A-Za-z0-9][A-Za-z0-9._:-]{0,127}$"},
    "timestamp": {"$ref": "common.schema.json#/$defs/timestamp"},
    "method": {"type": "string", "pattern": "^[a-z][a-z0-9_.-]{0,63}$"},
    "event": {"type": "string", "pattern": "^[a-z][a-z0-9_.-]{0,63}$"},
    "payload": {"type": "object", "additionalProperties": true},
    "ok": {"type": "boolean"},
    "result": {"type": "object", "additionalProperties": true},
    "error": {"$ref": "error.schema.json"}
  },
  "oneOf": [
    {"properties": {"kind": {"const": "request"}}, "required": ["method", "payload"], "not": {"anyOf": [{"required": ["event"]}, {"required": ["ok"]}, {"required": ["result"]}, {"required": ["error"]}]}},
    {"properties": {"kind": {"const": "event"}}, "required": ["event", "payload"], "not": {"anyOf": [{"required": ["method"]}, {"required": ["ok"]}, {"required": ["result"]}, {"required": ["error"]}]}},
    {"properties": {"kind": {"const": "response"}, "ok": {"const": true}}, "required": ["ok", "result"], "not": {"anyOf": [{"required": ["method"]}, {"required": ["event"]}, {"required": ["payload"]}, {"required": ["error"]}]}},
    {"properties": {"kind": {"const": "response"}, "ok": {"const": false}}, "required": ["ok", "error"], "not": {"anyOf": [{"required": ["method"]}, {"required": ["event"]}, {"required": ["payload"]}, {"required": ["result"]}]}}
  ]
}
